{
  "schema": "spec-agent-same-run-execution-metadata/1",
  "runId": "20261014-nenkin-high-01",
  "projectId": "nenkin",
  "capsuleManifestSha256": "aaaaaaaaaaaaaaaaaaaaaaaaaaaaaaaaaaaaaaaaaaaaaaaaaaaaaaaaaaaaaaaa",
  "executionContextSha256": "bbbbbbbbbbbbbbbbbbbbbbbbbbbbbbbbbbbbbbbbbbbbbbbbbbbbbbbbbbbbbbbb",
  "planSha256": "dddddddddddddddddddddddddddddddddddddddddddddddddddddddddddddddd",
  "sourceOnly": true,
  "businessEvidenceAuthority": false,
  "originalAppExecuted": false,
  "originalSpecificationsAuthorized": false,
  "evaluationExpectationsAuthorized": false,
  "newSourceReadPermissions": false,
  "documents": [
    {
      "documentId": "INDEX",
      "kind": "index",
      "path": "index.md"
    },
    {
      "documentId": "REPORT",
      "kind": "analysis-report",
      "path": "analysis/report.md"
    }
  ],
  "records": [
    {
      "kind": "routing",
      "path": "D:\\開発\\contextbase-evaluation\\agents\\spec-agent\\report\\20261014-nenkin-high-01\\independent-audit\\writer-metadata-r05-toy\\6\\report\\execution-metadata\\routing.json",
      "sha256": "ebc6830796c9fcd13360141321b094981ffd84a6db11f878d1dabe51a70677b4"
    },
    {
      "kind": "completion",
      "path": "D:\\開発\\contextbase-evaluation\\agents\\spec-agent\\report\\20261014-nenkin-high-01\\independent-audit\\writer-metadata-r05-toy\\6\\report\\execution-metadata\\completion.json",
      "sha256": "dbdf67559bccf9074247d03183e2867c862e7e8987b41d09739166b52e1e4009"
    }
  ]
}
