{
  "schema": "spec-agent-same-run-execution-metadata/1",
  "runId": "20261014-nenkin-high-01",
  "projectId": "nenkin",
  "capsuleManifestSha256": "f074529043ff1c25ea53be34c16ae3a4788f137a1e3afb33c6214de7bf4c7445",
  "executionContextSha256": "8966757e00954241029817027efa85bafeb859beee5105b05c7c939c84470605",
  "planSha256": "e14b5e5acd96aed44c800209efbe452d094cb595f7d57da097b8c9a4a7bc9ee3",
  "sourceOnly": true,
  "businessEvidenceAuthority": false,
  "originalAppExecuted": false,
  "originalSpecificationsAuthorized": false,
  "evaluationExpectationsAuthorized": false,
  "newSourceReadPermissions": false,
  "documents": [
    {
      "documentId": "ANL-TRACEABILITY",
      "kind": "analysis-report",
      "path": "analysis/identity-reachability-and-differences.md"
    }
  ],
  "records": [
    {
      "kind": "completion",
      "path": "D:\\開発\\contextbase-evaluation\\agents\\spec-agent\\report\\20261014-nenkin-high-01\\execution-metadata\\analysis-report-completion-snapshot-r01.json",
      "sha256": "d86ee4283470514a51673bd9dd6ee50722c79309409f906e0983fbe95d5dc848"
    },
    {
      "kind": "routing",
      "path": "D:\\開発\\contextbase-evaluation\\agents\\spec-agent\\report\\20261014-nenkin-high-01\\execution-metadata\\author-four-folder-routing-plan04-r01.json",
      "sha256": "035fc9f7dcc8aefa6b80702eab14591870da8b5334036d6a4d90856db3cd8cb6"
    }
  ]
}
